{
  "backend": "cloud-qwen-flash",
  "task": {
    "goal": "Return a concise strict-JSON summary",
    "instructions": [
      "Preserve source identifiers",
      "Return strict JSON"
    ],
    "inputs": [],
    "expected_output": {
      "format": "json",
      "required_keys": ["answer"]
    }
  },
  "context": {
    "mode": "compact",
    "target_tokens": 4096,
    "pinned": [
      "Do not modify canonical raw data"
    ]
  },
  "reasoning": {
    "mode": "off"
  },
  "privacy": {
    "cloud_allowed": true
  },
  "execution": {
    "mode": "direct"
  }
}
